[
  {
    "id": "regime_wei",
    "name": "曹魏",
    "startYear": 220,
    "endYear": 265,
    "color": "#5C6F94",
    "colorDark": "#7589AB",
    "parentDynastyId": "dynasty_three_kingdoms",
    "yearUncertainty": "year",
    "_schemaVersion": "v0.6",
    "source": "wxh06+manual",
    "siblingRegimeIds": [
      "regime_shu",
      "regime_wu"
    ]
  },
  {
    "id": "regime_shu",
    "name": "蜀汉",
    "startYear": 221,
    "endYear": 263,
    "color": "#4A7858",
    "colorDark": "#6A9477",
    "parentDynastyId": "dynasty_three_kingdoms",
    "yearUncertainty": "year",
    "_schemaVersion": "v0.6",
    "source": "wxh06+manual",
    "siblingRegimeIds": [
      "regime_wei",
      "regime_wu"
    ]
  },
  {
    "id": "regime_wu",
    "name": "东吴",
    "startYear": 229,
    "endYear": 280,
    "color": "#6189A6",
    "colorDark": "#7CA4C0",
    "parentDynastyId": "dynasty_three_kingdoms",
    "yearUncertainty": "year",
    "_schemaVersion": "v0.6",
    "source": "wxh06+manual",
    "siblingRegimeIds": [
      "regime_wei",
      "regime_shu"
    ]
  },
  {
    "id": "regime_northern_wei",
    "name": "北魏",
    "startYear": 386,
    "endYear": 534,
    "color": "#A89858",
    "colorDark": "#C2B070",
    "parentDynastyId": "dynasty_southern_northern",
    "yearUncertainty": "year",
    "_schemaVersion": "v0.6",
    "source": "wxh06+manual"
  },
  {
    "id": "regime_eastern_wei",
    "name": "东魏",
    "startYear": 534,
    "endYear": 550,
    "color": "#928550",
    "colorDark": "#AE9F68",
    "parentDynastyId": "dynasty_southern_northern",
    "yearUncertainty": "year",
    "_schemaVersion": "v0.6",
    "source": "wxh06+manual",
    "parentRegimeId": "regime_northern_wei",
    "mergedIntoRegimeId": "regime_northern_qi"
  },
  {
    "id": "regime_western_wei",
    "name": "西魏",
    "startYear": 535,
    "endYear": 557,
    "color": "#9E8F58",
    "colorDark": "#B8A875",
    "parentDynastyId": "dynasty_southern_northern",
    "yearUncertainty": "year",
    "_schemaVersion": "v0.6",
    "source": "wxh06+manual",
    "parentRegimeId": "regime_northern_wei",
    "mergedIntoRegimeId": "regime_northern_zhou"
  },
  {
    "id": "regime_northern_qi",
    "name": "北齐",
    "startYear": 550,
    "endYear": 577,
    "color": "#7B8A52",
    "colorDark": "#97A66E",
    "parentDynastyId": "dynasty_southern_northern",
    "yearUncertainty": "year",
    "_schemaVersion": "v0.6",
    "source": "wxh06+manual",
    "parentRegimeId": "regime_eastern_wei"
  },
  {
    "id": "regime_northern_zhou",
    "name": "北周",
    "startYear": 557,
    "endYear": 581,
    "color": "#8C7C50",
    "colorDark": "#A8966A",
    "parentDynastyId": "dynasty_southern_northern",
    "yearUncertainty": "year",
    "_schemaVersion": "v0.6",
    "source": "wxh06+manual",
    "parentRegimeId": "regime_western_wei"
  },
  {
    "id": "regime_song_liu",
    "name": "刘宋",
    "startYear": 420,
    "endYear": 479,
    "color": "#5E7B6E",
    "colorDark": "#7A9788",
    "parentDynastyId": "dynasty_southern_northern",
    "yearUncertainty": "year",
    "_schemaVersion": "v0.6",
    "source": "wxh06+manual"
  },
  {
    "id": "regime_qi_southern",
    "name": "南齐",
    "startYear": 479,
    "endYear": 502,
    "color": "#6E8A7A",
    "colorDark": "#8AA697",
    "parentDynastyId": "dynasty_southern_northern",
    "yearUncertainty": "year",
    "_schemaVersion": "v0.6",
    "source": "wxh06+manual",
    "parentRegimeId": "regime_song_liu"
  },
  {
    "id": "regime_liang_southern",
    "name": "南梁",
    "startYear": 502,
    "endYear": 557,
    "color": "#7A9582",
    "colorDark": "#94B09D",
    "parentDynastyId": "dynasty_southern_northern",
    "yearUncertainty": "year",
    "_schemaVersion": "v0.6",
    "source": "wxh06+manual",
    "parentRegimeId": "regime_qi_southern"
  },
  {
    "id": "regime_chen",
    "name": "陈",
    "startYear": 557,
    "endYear": 589,
    "color": "#6E8E7E",
    "colorDark": "#8AAA9A",
    "parentDynastyId": "dynasty_southern_northern",
    "yearUncertainty": "year",
    "_schemaVersion": "v0.6",
    "source": "wxh06+manual",
    "parentRegimeId": "regime_liang_southern"
  },
  {
    "id": "regime_han_zhao",
    "name": "汉赵",
    "startYear": 304,
    "endYear": 329,
    "color": "#8C6B4B",
    "colorDark": "#A8856A",
    "parentDynastyId": "dynasty_sixteen_kingdoms",
    "yearUncertainty": "year",
    "_schemaVersion": "v0.6",
    "source": "wxh06+manual"
  },
  {
    "id": "regime_cheng_han",
    "name": "成汉",
    "startYear": 306,
    "endYear": 347,
    "color": "#9A7858",
    "colorDark": "#B69077",
    "parentDynastyId": "dynasty_sixteen_kingdoms",
    "yearUncertainty": "year",
    "_schemaVersion": "v0.6",
    "source": "wxh06+manual"
  },
  {
    "id": "regime_former_liang",
    "name": "前凉",
    "startYear": 314,
    "endYear": 376,
    "color": "#A89072",
    "colorDark": "#C2A88C",
    "parentDynastyId": "dynasty_sixteen_kingdoms",
    "yearUncertainty": "year",
    "_schemaVersion": "v0.6",
    "source": "wxh06+manual"
  },
  {
    "id": "regime_later_zhao",
    "name": "后赵",
    "startYear": 319,
    "endYear": 351,
    "color": "#7A5A40",
    "colorDark": "#94765C",
    "parentDynastyId": "dynasty_sixteen_kingdoms",
    "yearUncertainty": "year",
    "_schemaVersion": "v0.6",
    "source": "wxh06+manual"
  },
  {
    "id": "regime_former_yan",
    "name": "前燕",
    "startYear": 337,
    "endYear": 370,
    "color": "#8E7A5C",
    "colorDark": "#A89478",
    "parentDynastyId": "dynasty_sixteen_kingdoms",
    "yearUncertainty": "year",
    "_schemaVersion": "v0.6",
    "source": "wxh06+manual"
  },
  {
    "id": "regime_former_qin",
    "name": "前秦",
    "startYear": 350,
    "endYear": 394,
    "color": "#8C6F50",
    "colorDark": "#A8896E",
    "parentDynastyId": "dynasty_sixteen_kingdoms",
    "yearUncertainty": "year",
    "_schemaVersion": "v0.6",
    "source": "wxh06+manual"
  },
  {
    "id": "regime_later_yan",
    "name": "后燕",
    "startYear": 384,
    "endYear": 407,
    "color": "#7E6A50",
    "colorDark": "#9A866E",
    "parentDynastyId": "dynasty_sixteen_kingdoms",
    "yearUncertainty": "year",
    "_schemaVersion": "v0.6",
    "source": "wxh06+manual"
  },
  {
    "id": "regime_later_qin",
    "name": "后秦",
    "startYear": 384,
    "endYear": 417,
    "color": "#85684C",
    "colorDark": "#A0846A",
    "parentDynastyId": "dynasty_sixteen_kingdoms",
    "yearUncertainty": "year",
    "_schemaVersion": "v0.6",
    "source": "wxh06+manual"
  },
  {
    "id": "regime_western_qin",
    "name": "西秦",
    "startYear": 385,
    "endYear": 431,
    "color": "#94785C",
    "colorDark": "#AE9078",
    "parentDynastyId": "dynasty_sixteen_kingdoms",
    "yearUncertainty": "year",
    "_schemaVersion": "v0.6",
    "source": "wxh06+manual"
  },
  {
    "id": "regime_later_liang_16",
    "name": "后凉",
    "startYear": 389,
    "endYear": 403,
    "color": "#705840",
    "colorDark": "#8C7560",
    "parentDynastyId": "dynasty_sixteen_kingdoms",
    "yearUncertainty": "year",
    "_schemaVersion": "v0.6",
    "source": "wxh06+manual"
  },
  {
    "id": "regime_southern_liang",
    "name": "南凉",
    "startYear": 397,
    "endYear": 414,
    "color": "#7C6850",
    "colorDark": "#988570",
    "parentDynastyId": "dynasty_sixteen_kingdoms",
    "yearUncertainty": "year",
    "_schemaVersion": "v0.6",
    "source": "wxh06+manual"
  },
  {
    "id": "regime_northern_liang",
    "name": "北凉",
    "startYear": 397,
    "endYear": 439,
    "color": "#82704F",
    "colorDark": "#9C8A6E",
    "parentDynastyId": "dynasty_sixteen_kingdoms",
    "yearUncertainty": "year",
    "_schemaVersion": "v0.6",
    "source": "wxh06+manual"
  },
  {
    "id": "regime_southern_yan",
    "name": "南燕",
    "startYear": 398,
    "endYear": 410,
    "color": "#86684A",
    "colorDark": "#A0846A",
    "parentDynastyId": "dynasty_sixteen_kingdoms",
    "yearUncertainty": "year",
    "_schemaVersion": "v0.6",
    "source": "wxh06+manual"
  },
  {
    "id": "regime_western_liang",
    "name": "西凉",
    "startYear": 400,
    "endYear": 421,
    "color": "#90785A",
    "colorDark": "#AC9276",
    "parentDynastyId": "dynasty_sixteen_kingdoms",
    "yearUncertainty": "year",
    "_schemaVersion": "v0.6",
    "source": "wxh06+manual"
  },
  {
    "id": "regime_hu_xia",
    "name": "胡夏",
    "startYear": 407,
    "endYear": 431,
    "color": "#754F38",
    "colorDark": "#906A55",
    "parentDynastyId": "dynasty_sixteen_kingdoms",
    "yearUncertainty": "year",
    "_schemaVersion": "v0.6",
    "source": "wxh06+manual"
  },
  {
    "id": "regime_northern_yan",
    "name": "北燕",
    "startYear": 407,
    "endYear": 436,
    "color": "#7E6850",
    "colorDark": "#9A866E",
    "parentDynastyId": "dynasty_sixteen_kingdoms",
    "yearUncertainty": "year",
    "_schemaVersion": "v0.6",
    "source": "wxh06+manual"
  },
  {
    "id": "regime_later_liang",
    "name": "后梁",
    "startYear": 907,
    "endYear": 923,
    "color": "#806147",
    "colorDark": "#997D62",
    "parentDynastyId": "dynasty_five_dynasties_ten_kingdoms",
    "yearUncertainty": "year",
    "_schemaVersion": "v0.6",
    "source": "wxh06+manual"
  },
  {
    "id": "regime_later_tang",
    "name": "后唐",
    "startYear": 923,
    "endYear": 937,
    "color": "#A05B47",
    "colorDark": "#B87862",
    "parentDynastyId": "dynasty_five_dynasties_ten_kingdoms",
    "yearUncertainty": "year",
    "_schemaVersion": "v0.6",
    "source": "wxh06+manual",
    "parentRegimeId": "regime_later_liang"
  },
  {
    "id": "regime_later_jin",
    "name": "后晋",
    "startYear": 937,
    "endYear": 947,
    "color": "#7A6B5C",
    "colorDark": "#94867A",
    "parentDynastyId": "dynasty_five_dynasties_ten_kingdoms",
    "yearUncertainty": "year",
    "_schemaVersion": "v0.6",
    "source": "wxh06+manual",
    "parentRegimeId": "regime_later_tang"
  },
  {
    "id": "regime_later_han",
    "name": "后汉",
    "startYear": 947,
    "endYear": 951,
    "color": "#8B5C4F",
    "colorDark": "#A47A6C",